ID,focus,focus ID,adj idx,det idx,before,before gender,deprel,number,dep tree size,after,focus ID after,after gender
4930,asesor,25,-1,24,"En enero de 1971 , se matriculó en el programa de doctorado en la Universidad de Texas , y Robert Simmons fue asignado como su asesor . ",Masc,obl,Sing,4,"En enero de 1971 , se matriculó en el programa de doctorado en la Universidad de Texas , y Robert Simmons fue asignado como su asesora . ",25,Fem
4933,escritor,1,2,0,"El escritor uruguayo destacó el "" compromiso de vida constante "" de Sábato con la defensa de los derechos humanos y la "" formidable batalla "" que dio como presidente de la Comisión Nacional sobre Desaparición de Personas ( Conadep ) , de Argentina . ",Masc,nsubj,Sing,4,"La escritora uruguaya destacó el "" compromiso de vida constante "" de Sábato con la defensa de los derechos humanos y la "" formidable batalla "" que dio como presidente de la Comisión Nacional sobre Desaparición de Personas ( Conadep ) , de Argentina . ",1,Fem
4951,niña,29,-1,-1,""" La vacuna contra el virus de papiloma humano o VPH ( HPV , según su sigla en inglés ) es esencial en esta etapa porque se coloca a niñas de 11 años , edad en la que , se calcula , aun no tuvieron contacto con el virus . ",Fem,iobj,Plur,22,""" La vacuna contra el virus de papiloma humano o VPH ( HPV , según su sigla en inglés ) es esencial en esta etapa porque se coloca a niños de 11 años , edad en la que , se calcula , aun no tuvieron contacto con el virus . ",29,Masc
4957,niño,1,-1,-1,De niño jugaba con gusanillos de seda . ,Masc,obl,Sing,3,De niña jugaba con gusanillos de seda . ,1,Fem
4964,esposo,6,-1,5,Me hospedé 7 días con mi esposo y mi hijo de 3 años . ,Masc,obl,Sing,10,Me hospedé 7 días con mi esposa y mi hijo de 3 años . ,6,Fem
4979,prima,7,-1,6,"En Alemania , además se aporta una prima por el autoconsumo . ",Fem,obj,Sing,6,"En Alemania , además se aporta un primo por el autoconsumo . ",7,Masc
4980,presidente,9,-1,8,"Los etnocaceristas y yo vamos a apoyar a nuestro presidente y confiamos en ( que nos dará ) la amnistía "" . ",Masc,obj,Sing,4,"Los etnocaceristas y yo vamos a apoyar a nuestros presidenta y confiamos en ( que nos dará ) la amnistía "" . ",9,Fem
5013,mujer,25,-1,-1,"El Departamento de Defensa de los Estados Unidos investigó si esto podría haber llegado a violar el "" Mann Act "" ( que prohibía llevar mujeres más allá de los límites estatales para fines sexuales ) , de todas formas no se filmó sexo y ninguna línea divisoria entre estados fue cruzada en esta parte de la filmación , dado que el Valle de la muerte está en California . ",Fem,obj,Plur,2,"El Departamento de Defensa de los Estados Unidos investigó si esto podría haber llegado a violar el "" Mann Act "" ( que prohibía llevar hombres más allá de los límites estatales para fines sexuales ) , de todas formas no se filmó sexo y ninguna línea divisoria entre estados fue cruzada en esta parte de la filmación , dado que el Valle de la muerte está en California . ",25,Masc
5036,jugador,23,-1,22,""" La inversión que teníamos era para el lateral izquierdo e hicimos una oferta muy buena tanto para el Murcia como para el jugador , pero lo querían el Madrid , el Zaragoza y el Schalke y lo ha fichado este último "" , apuntó Lotina . ",Masc,nmod,Sing,4,""" La inversión que teníamos era para el lateral izquierdo e hicimos una oferta muy buena tanto para el Murcia como para la jugadora , pero lo querían el Madrid , el Zaragoza y el Schalke y lo ha fichado este último "" , apuntó Lotina . ",23,Fem
5054,hijo,15,-1,14,"Entre la lista de posibles castigados , además de Kadhafi , están siete de sus hijos ( Khamis , Hannibal , Mohamed , Said el Arab , Said el Islam , Mutassim y Aisha ) , además de varios familiares y los máximos responsables de los aparatos de seguridad , inteligencia y fuerzas armadas . ",Masc,nmod,Plur,4,"Entre la lista de posibles castigados , además de Kadhafi , están siete de sus hijas ( Khamis , Hannibal , Mohamed , Said el Arab , Said el Islam , Mutassim y Aisha ) , además de varios familiares y los máximos responsables de los aparatos de seguridad , inteligencia y fuerzas armadas . ",15,Fem
5074,detenido,1,2,-1,"Numerosos detenidos políticos durante la última dictadura militar , eran sometidos a Tribunales o Consejos de Guerra Especiales donde los propios represores montaban la escena de la "" justicia "" que a ellos les parecía . ",Masc,nsubj:pass,Plur,10,"Numerosas detenidas políticas durante la última dictadura militar , eran sometidos a Tribunales o Consejos de Guerra Especiales donde los propios represores montaban la escena de la "" justicia "" que a ellos les parecía . ",1,Fem
5195,autor,4,-1,3,"Por ejemplo , los autores de la Constitución de los Estados Unidos sería un grupo de "" Padres Fundadores "" que la redactaron . ",Masc,nsubj,Plur,10,"Por ejemplo , las autoras de la Constitución de los Estados Unidos sería un grupo de "" Padres Fundadores "" que la redactaron . ",4,Fem
5199,hombre,5,-1,4,Por ahora son muchos los hombres que ocuparían la posición . ,Masc,nsubj,Plur,7,Por ahora son muchas las mujeres que ocuparían la posición . ,5,Fem
5282,extranjero,2,-1,1,"En el extranjero , Emperatriz está sola , embarazada de su segundo hijo y a punto de ser deportada . ",Masc,nmod,Sing,5,"En la extranjera , Emperatriz está sola , embarazada de su segundo hijo y a punto de ser deportada . ",2,Fem
5282,hijo,12,-1,10,"En el extranjero , Emperatriz está sola , embarazada de su segundo hijo y a punto de ser deportada . ",Masc,obl,Sing,5,"En el extranjero , Emperatriz está sola , embarazada de su segundo hija y a punto de ser deportada . ",12,Fem
5393,diseñador,5,-1,4,"Mediante cortes asimétricos , el diseñador creó sofisticados vestidos de cóctel y noche , faldas de capas , chaquetas muy entalladas y cazadoras tipo kimono , en los que el tejido de saco mezclado con lino llamó la atención . ",Masc,nsubj,Sing,3,"Mediante cortes asimétricos , la diseñadora creó sofisticados vestidos de cóctel y noche , faldas de capas , chaquetas muy entalladas y cazadoras tipo kimono , en los que el tejido de saco mezclado con lino llamó la atención . ",5,Fem
5411,hombre,1,-1,0,"Los hombres tenían unos ingresos medios de $ 36,955 frente a los $ 24,038 para las mujeres . ",Masc,nsubj,Plur,3,"Las mujeres tenían unos ingresos medios de $ 36,955 frente a los $ 24,038 para las mujeres . ",1,Fem
5524,mujer,14,-1,13,No conocía París y acerté el primer día comiendo en el Barlotti con mi mujer y mis hijos . ,Fem,obl,Sing,7,No conocía París y acerté el primer día comiendo en el Barlotti con mi hombre y mis hijos . ,14,Masc
5536,hombre,1,-1,0,"Los hombres tenían unos ingresos medios de $ 31,944 frente a los $ 26,071 para las mujeres . ",Masc,nsubj,Plur,3,"Las mujeres tenían unos ingresos medios de $ 31,944 frente a los $ 26,071 para las mujeres . ",1,Fem
5536,mujer,16,-1,15,"Los hombres tenían unos ingresos medios de $ 31,944 frente a los $ 26,071 para las mujeres . ",Fem,nmod,Plur,4,"Los hombres tenían unos ingresos medios de $ 31,944 frente a los $ 26,071 para los hombres . ",16,Masc
5553,padre,1,-1,0,"Los padres llevan a los niños a hospitales públicos donde no hay especialistas , pero donde es fácil obtener la medicación . ",Masc,nsubj,Plur,3,"Las madres llevan a los niños a hospitales públicos donde no hay especialistas , pero donde es fácil obtener la medicación . ",1,Fem
5553,niño,5,-1,4,"Los padres llevan a los niños a hospitales públicos donde no hay especialistas , pero donde es fácil obtener la medicación . ",Masc,obj,Plur,4,"Los padres llevan a las niñas a hospitales públicos donde no hay especialistas , pero donde es fácil obtener la medicación . ",5,Fem
5582,abogado,8,7,6,"Ahora ya es adulto , es un prestigioso abogado y tiene una encantadora familia , pero ha perdido el contacto con algo maravilloso : su infancia . ",Masc,conj,Sing,23,"Ahora ya es adulto , es una prestigiosa abogada y tiene una encantadora familia , pero ha perdido el contacto con algo maravilloso : su infancia . ",8,Fem
5623,hijo,3,-1,-1,Ahora tengo seis hijos y ninguna teoría » . ,Masc,obj,Plur,6,Ahora tengo seis hijas y ninguna teoría » . ,3,Fem
5681,pescador,8,-1,7,Con posterioridad intervendrá en La Bohème y Los pescadores de perlas . ,Masc,conj,Plur,6,Con posterioridad intervendrá en La Bohème y Las pescadoras de perlas . ,8,Fem
5726,candidato,28,-1,27,"Los resultados de las elecciones internas consagraron el liderazgo de de la Sota , dado que el Peronismo Renovador obtuvo el 86,98 % de los votos para el candidato a gobernador y el 82,35 % para el candidato a intendente . ",Masc,nmod,Sing,6,"Los resultados de las elecciones internas consagraron el liderazgo de de la Sota , dado que el Peronismo Renovador obtuvo el 86,98 % de los votos para la candidata a gobernador y el 82,35 % para el candidato a intendente . ",28,Fem
5726,candidato,37,-1,36,"Los resultados de las elecciones internas consagraron el liderazgo de de la Sota , dado que el Peronismo Renovador obtuvo el 86,98 % de los votos para el candidato a gobernador y el 82,35 % para el candidato a intendente . ",Masc,nmod,Sing,6,"Los resultados de las elecciones internas consagraron el liderazgo de de la Sota , dado que el Peronismo Renovador obtuvo el 86,98 % de los votos para el candidato a gobernador y el 82,35 % para la candidata a intendente . ",37,Fem
5753,fundador,3,-1,2,"Fue también el fundador de la galería pictórica de Kassel , en la que se incluyeron cuadros de Rembrandt y Rubens . ",Masc,root,Sing,23,"Fue también la fundadora de la galería pictórica de Kassel , en la que se incluyeron cuadros de Rembrandt y Rubens . ",3,Fem
5766,músico,3,4,2,• A estos músicos singulares los completará una música también muy creativa y personal : el jazz . ,Masc,obj,Plur,5,• A estas músicas singulares los completará una música también muy creativa y personal : el jazz . ,3,Fem
5789,chico,10,-1,9,"Además la semana anterior ya les habían robado a otros chicos en estos mismos apartamentos Bahia Dorada , que no poseen ningún tipo de seguridad . ",Masc,obj,Plur,4,"Además la semana anterior ya les habían robado a otras chicas en estos mismos apartamentos Bahia Dorada , que no poseen ningún tipo de seguridad . ",10,Fem
5800,mentor,21,-1,20,"Nacida Kristina Jonasdotter en Smaland , hija de los campesinos Jonas Nilsson y Cajsa - Stina Månsdotter fue descubierta por un mentor que permitió su desarrollo vocal . ",Masc,obl,Sing,9,"Nacida Kristina Jonasdotter en Smaland , hija de los campesinos Jonas Nilsson y Cajsa - Stina Månsdotter fue descubierta por una mentora que permitió su desarrollo vocal . ",21,Fem
5831,sobrino,7,-1,6,"Tenía que hacer un regalo a un sobrino , no sabía que comprar y allí me asesoraron . ",Masc,iobj,Sing,4,"Tenía que hacer un regalo a una sobrina , no sabía que comprar y allí me asesoraron . ",7,Fem
5893,hombre,1,-1,0,Los hombres tuvieron un ingreso promedio de $ 30.757 contra $ 23.931 de las mujeres . ,Masc,nsubj,Plur,3,Las mujeres tuvieron un ingreso promedio de $ 30.757 contra $ 23.931 de las mujeres . ,1,Fem
5902,secretario,22,23,21,"Algunos años más tarde , cuando Obregón era ministro de Guerra ( 1916 -- 1917 ) , Sáenz se convirtió en su secretario particular y después en jefe de Estado Mayor . ",Masc,obl,Sing,12,"Algunos años más tarde , cuando Obregón era ministro de Guerra ( 1916 -- 1917 ) , Sáenz se convirtió en su secretaria particular y después en jefe de Estado Mayor . ",22,Fem
6018,música,10,11,-1,El ambiente es bueno y el local está ambientado con música india y tapices que transportan a la India . ,Fem,nmod,Sing,11,El ambiente es bueno y el local está ambientado con músico india y tapices que transportan a la India . ,10,Masc
6060,profesor,1,-1,0,"El profesor sólo tiene su palabra como herramienta de trabajo , si se la quitamos , es un trabajador sin herramientas , no podrá hacer ningún trabajo útil con los alumnos . ",Masc,nsubj,Sing,3,"La profesora sólo tiene su palabra como herramienta de trabajo , si se la quitamos , es un trabajador sin herramientas , no podrá hacer ningún trabajo útil con los alumnos . ",1,Fem
6143,música,1,-1,0,La música de fondo que suena en la cinta de video de Flanders es I 'm Too Sexy de Right Said Fred . ,Fem,nsubj,Sing,14,El músico de fondo que suena en la cinta de video de Flanders es I 'm Too Sexy de Right Said Fred . ,1,Masc
6180,madre,8,-1,7,Antes de que los murciélagos puedan volar la madre carga hasta cuatro crías a la vez . ,Fem,nsubj,Sing,3,Antes de que los murciélagos puedan volar el padre carga hasta cuatro crías a la vez . ,8,Masc
6216,pintor,2,-1,1,"Buscaba el pintor experimentar las leyes de su pintura , construir la verdad con sus propios medios artísticos . ",Masc,nsubj,Sing,3,"Buscaba la pintora experimentar las leyes de su pintura , construir la verdad con sus propios medios artísticos . ",2,Fem
6225,empresario,14,-1,-1,"Hace bien poco que los controladores aéreos se declararon en huelga y no faltaron empresarios que pusieron el grito en el cielo contra los "" privilegiados "" que se ponen en huelga y "" secuestran un país "" porque tienen en su mano un servicio público como los aeropuertos . ",Masc,nsubj,Plur,36,"Hace bien poco que los controladores aéreos se declararon en huelga y no faltaron empresarias que pusieron el grito en el cielo contra los "" privilegiados "" que se ponen en huelga y "" secuestran un país "" porque tienen en su mano un servicio público como los aeropuertos . ",14,Fem
6281,hombre,34,-1,33,"Con el Thunderbird 2 fuera de servicio debido a un ataque accidental de la Armada , ¿ cómo Gordon transportará el Thunderbird 4 a Nueva York navegar un río subterráneo y salvar a los hombres antes de que su refugio sea completamente inundado ? ",Masc,obj,Plur,4,"Con el Thunderbird 2 fuera de servicio debido a un ataque accidental de la Armada , ¿ cómo Gordon transportará el Thunderbird 4 a Nueva York navegar un río subterráneo y salvar a las mujeres antes de que su refugio sea completamente inundado ? ",34,Fem
6282,jugador,6,-1,5,Andrés Iniesta es uno de esos jugadores que todo equipo quisiera tener . ,Masc,nmod,Plur,9,Andrés Iniesta es uno de esas jugadoras que todo equipo quisiera tener . ,6,Fem
6323,individuo,24,-1,-1,"También se dijo que un proceso tan vasto , con tantos acusados , no daba garantías constitucionales suficientes a cada uno de ellos como individuos , y que era un intento de "" hacer justicia en serie "" , como escribió un periodista . ",Masc,nmod,Plur,3,"También se dijo que un proceso tan vasto , con tantos acusados , no daba garantías constitucionales suficientes a cada uno de ellos como individuas , y que era un intento de "" hacer justicia en serie "" , como escribió un periodista . ",24,Fem
6328,individuo,30,31,-1,"Además , las fibras de elevada viscosidad y las capaces de generar geles aportan una ventaja adicional : incrementan la sensación de saciedad , lo cual , posiblemente , en individuos obesos conduce a reducción de peso . ",Masc,obl,Plur,4,"Además , las fibras de elevada viscosidad y las capaces de generar geles aportan una ventaja adicional : incrementan la sensación de saciedad , lo cual , posiblemente , en individuas obesas conduce a reducción de peso . ",30,Fem
6332,compañero,13,-1,12,"No participó en la Revolución de 1934 , pero sí defendió a algunos compañeros y amigos suyos que habían tomado parte , como el capitán de la Guardia Civil , Fernando Condés . ",Masc,obj,Plur,22,"No participó en la Revolución de 1934 , pero sí defendió a algunas compañeras y amigos suyos que habían tomado parte , como el capitán de la Guardia Civil , Fernando Condés . ",13,Fem
6339,música,6,7,5,"El glissando se utiliza en la música vocal con propósitos expresivos , imitando las inflexiones de la voz que se emplean comúnmente ( llanto , grito , risa , y otros ) . ",Fem,obl,Sing,5,"El glissando se utiliza en el músico vocal con propósitos expresivos , imitando las inflexiones de la voz que se emplean comúnmente ( llanto , grito , risa , y otros ) . ",6,Masc
6347,pilar,1,-1,0,Estos pilares también se usaban para señalar los límites fronterizos o para delimitar los diferentes estados . ,Masc,nsubj,Plur,3,Estas pilaras también se usaban para señalar los límites fronterizos o para delimitar los diferentes estados . ,1,Fem
6356,padre,6,-1,5,"Con veinte años pierde a su padre y hereda una buena fortuna , lo que le induce a viajar , primero por Italia , en donde asomó su faceta de jugador que le acompañó durante toda su vida . ",Masc,obj,Sing,4,"Con veinte años pierde a su madre y hereda una buena fortuna , lo que le induce a viajar , primero por Italia , en donde asomó su faceta de jugador que le acompañó durante toda su vida . ",6,Fem
6390,elector,1,-1,0,Los electores han votado con más frecuencia por los candidatos liberales a nivel estatal y federal que los de cualquier otra región en los Estados Unidos . ,Masc,nsubj,Plur,3,Las electoras han votado con más frecuencia por los candidatos liberales a nivel estatal y federal que los de cualquier otra región en los Estados Unidos . ,1,Fem
6396,jefe,2,1,0,"Los principales jefes de estos cuerpos eran : el General Bohórquez , el General Armero ( jefe de artillería compuesta de 4 cañones ) , el General Anzola , el General Pedro Marcos de la Rosa ; ",Masc,nsubj,Plur,7,"Las principales jefas de estos cuerpos eran : el General Bohórquez , el General Armero ( jefe de artillería compuesta de 4 cañones ) , el General Anzola , el General Pedro Marcos de la Rosa ; ",2,Fem
6406,hombre,1,-1,0,"Los hombres tenían unos ingresos medios de $ 24,000 frente a los $ 20,750 para las mujeres . ",Masc,nsubj,Plur,3,"Las mujeres tenían unos ingresos medios de $ 24,000 frente a los $ 20,750 para las mujeres . ",1,Fem
6406,mujer,16,-1,15,"Los hombres tenían unos ingresos medios de $ 24,000 frente a los $ 20,750 para las mujeres . ",Fem,nmod,Plur,4,"Los hombres tenían unos ingresos medios de $ 24,000 frente a los $ 20,750 para los hombres . ",16,Masc
6408,director,4,5,-1,Enseguida se convirtió en director deportivo ejerciendo sus funciones en el equipo Omega Pharma - Lotto . ,Masc,obl,Sing,4,Enseguida se convirtió en directora deportiva ejerciendo sus funciones en el equipo Omega Pharma - Lotto . ,4,Fem
6455,hermano,1,-1,-1,"Es hermano de los también jugadores profesionales Campy y Walker Russell , y tío de Walker Russell Jr. . ",Masc,root,Sing,20,"Es hermana de los también jugadores profesionales Campy y Walker Russell , y tío de Walker Russell Jr. . ",1,Fem
6514,secretario,19,-1,18,"Las constituciones de 1967 y 2004 dicen sobre ellos : "" El Presidente de la República designará libremente un Secretario y un Prosecretario , quienes actuarán como tales en el Consejo de Ministros . ",Masc,obj,Sing,16,"Las constituciones de 1967 y 2004 dicen sobre ellos : "" El Presidente de la República designará libremente una Secretaria y un Prosecretario , quienes actuarán como tales en el Consejo de Ministros . ",19,Fem
6583,director,3,-1,-1,Fue creador y director de la histórica revista satírica El Be Negre durante toda su corta trayectoria ( 1931-1936 ) . ,Masc,conj,Sing,3,Fue creador y directora de la histórica revista satírica El Be Negre durante toda su corta trayectoria ( 1931-1936 ) . ,3,Fem
6590,novia,13,-1,12,También en este escenario pasaron tiempo juntos en la playa Chad y su novia . ,Fem,conj,Sing,4,También en este escenario pasaron tiempo juntos en la playa Chad y su novio . ,13,Masc
6603,acusado,2,-1,1,"Entre los acusados están la hija de un millonario , un profesor asistente , un trabajador benéfico y un chico de 11 años . ",Masc,obl,Plur,4,"Entre las acusadas están la hija de un millonario , un profesor asistente , un trabajador benéfico y un chico de 11 años . ",2,Fem
6603,hija,5,-1,4,"Entre los acusados están la hija de un millonario , un profesor asistente , un trabajador benéfico y un chico de 11 años . ",Fem,nsubj,Sing,20,"Entre los acusados están el hijo de un millonario , un profesor asistente , un trabajador benéfico y un chico de 11 años . ",5,Masc
6609,jugador,5,-1,4,"Sinceramente , veo a los jugadores muy metidos y no he necesitado tener charlas individuales con ninguno de ellos , porque el grupo está plenamente concentrado . ",Masc,obj,Plur,4,"Sinceramente , veo a las jugadoras muy metidos y no he necesitado tener charlas individuales con ninguno de ellos , porque el grupo está plenamente concentrado . ",5,Fem
6662,hombre,1,-1,0,"El hombre se roció con nafta y se prendió fuego , pero las llamas fueron apagadas rápidamente , dijeron las fuentes . ",Masc,nsubj,Sing,3,"La mujer se roció con nafta y se prendió fuego , pero las llamas fueron apagadas rápidamente , dijeron las fuentes . ",1,Fem
6713,mujer,9,-1,8,"Por esto , se dio la libertad a la mujer , años antes de que en Colombia se aboliera el sistema esclavista . ",Fem,iobj,Sing,5,"Por esto , se dio la libertad al hombre , años antes de que en Colombia se aboliera el sistema esclavista . ",8,Masc
6716,profesor,1,6,-1,"Es profesor de literatura francesa , casado y tiene dos hijos . ",Masc,root,Sing,13,"Es profesora de literatura francesa , casada y tiene dos hijos . ",1,Fem
6749,madre,9,10,8,"Mitch , quien pasaba su tiempo cuidando a su madre enferma , se sentía muy solo , y ve a Blanche como la cura de su soledad . ",Fem,obj,Sing,5,"Mitch , quien pasaba su tiempo cuidando a su padre enferma , se sentía muy solo , y ve a Blanche como la cura de su soledad . ",9,Masc
6784,chica,16,-1,15,"Es bastante quejumbroso y lujurioso , cuando tiene la oportunidad intenta pervertir a alguna de las chicas , le da un toque bastante cómico a la serie . ",Fem,nmod,Plur,4,"Es bastante quejumbroso y lujurioso , cuando tiene la oportunidad intenta pervertir a alguna de los chicos , le da un toque bastante cómico a la serie . ",16,Masc
6800,ministro,17,-1,16,"Pero como consecuencia de las lluvias , dicha cifra pudo disminuir un 50 % , apuntó el ministro . ",Masc,nsubj,Sing,3,"Pero como consecuencia de las lluvias , dicha cifra pudo disminuir un 50 % , apuntó la ministra . ",17,Fem
6810,usuario,12,-1,11,"Muchos programas de colaboración almacenan remotamente los datos para que todos los usuarios trabajen con la misma información , y utilizan clientes híbridos para acceder a esa información . ",Masc,nsubj,Plur,4,"Muchos programas de colaboración almacenan remotamente los datos para que todas las usuarias trabajen con la misma información , y utilizan clientes híbridos para acceder a esa información . ",12,Fem
6873,anfitrión,26,-1,-1,"Después de las noticias recibidas de la pérdida de dinero de los Juegos Olímpicos de Montreal 1976 en Canadá , ninguna ciudad se presentó para ser anfitrión de los juegos de 1984 . ",Masc,advcl,Sing,9,"Después de las noticias recibidas de la pérdida de dinero de los Juegos Olímpicos de Montreal 1976 en Canadá , ninguna ciudad se presentó para ser anfitrióna de los juegos de 1984 . ",26,Fem
6889,madre,35,-1,34,"Sabía dónde había estado y dónde estaba , a mí nunca me contó detalles de lo que había vivido ahí adentro , lo que sí me contó es que lo habían torturado delante de su madre para que ella diera los datos de una hipoteca o de una casa que tenían . ",Fem,obl,Sing,5,"Sabía dónde había estado y dónde estaba , a mí nunca me contó detalles de lo que había vivido ahí adentro , lo que sí me contó es que lo habían torturado delante de su padre para que ella diera los datos de una hipoteca o de una casa que tenían . ",35,Masc
6893,pupila,12,15,-1,"Los efectos clínicos que indican una administración excesiva incluyen efectos periféricos como pupilas dilatadas no reactivas , visión borrosa , piel seca , caliente y enrojecida , sequedad de mucosas , hipertermia , elevación de la presión sanguínea y aumento de la respiración . ",Fem,obl,Plur,33,"Los efectos clínicos que indican una administración excesiva incluyen efectos periféricos como pupilos dilatados no reactivos , visión borrosa , piel seca , caliente y enrojecida , sequedad de mucosas , hipertermia , elevación de la presión sanguínea y aumento de la respiración . ",12,Masc
6911,usuario,6,-1,5,"Está estrictamente prohibido insultar a los usuarios , promocionar marcas comerciales o escribir mensajes que inciten a la violencia o discriminación . ",Masc,obj,Plur,4,"Está estrictamente prohibido insultar a las usuarias , promocionar marcas comerciales o escribir mensajes que inciten a la violencia o discriminación . ",6,Fem
6934,empleado,5,-1,4,"El trabajo lo harán los empleados , durará dos meses y comenzará la semana que viene . ",Masc,nsubj,Plur,3,"El trabajo lo harán las empleadas , durará dos meses y comenzará la semana que viene . ",5,Fem
6938,autor,1,-1,-1,Es autor de una docena de libros especializados . ,Masc,root,Sing,10,Es autora de una docena de libros especializados . ,1,Fem
6962,cazador,2,-1,1,"Como los cazadores preparan sus armas , que recuerdan la Guerra Civil y la emoción de la caza de los hombres en lugar de animales . ",Masc,obl,Plur,4,"Como las cazadoras preparan sus armas , que recuerdan la Guerra Civil y la emoción de la caza de los hombres en lugar de animales . ",2,Fem
6990,pareja,5,-1,4,"Fui en verano con mi pareja y nos encantó , las tapas estaban buenísimas , así que pedimos un par de bocadillos y genial . ",Fem,obl,Sing,4,"Fui en verano con mi socio y nos encantó , las tapas estaban buenísimas , así que pedimos un par de bocadillos y genial . ",5,Masc
7016,mujer,9,10,7,"En un edificio , ellos encuentran a una joven mujer ginoide , pero sin daño alguno . ",Fem,obj,Sing,6,"En un edificio , ellos encuentran a un joven hombre ginoide , pero sin daño alguno . ",9,Masc
