ID,focus,focus ID,adj idx,det idx,before,before gender,deprel,number,dep tree size,after,focus ID after,after gender
7050,amigo,4,-1,3,"Fuimos recomendados por un amigo , y acertó . ",Masc,obl,Sing,4,"Fuimos recomendados por una amiga , y acertó . ",4,Fem
7081,extranjero,6,-1,-1,"En mayo de 2004 , 22 extranjeros fueron asesinados en una toma de rehenes , en septiembre de 2005 , fuerzas de seguridad saudíes irrumpieron en un escondite y mataron a todos los terroristas . ",Masc,nsubj:pass,Plur,3,"En mayo de 2004 , 22 extranjeras fueron asesinados en una toma de rehenes , en septiembre de 2005 , fuerzas de seguridad saudíes irrumpieron en un escondite y mataron a todos los terroristas . ",6,Fem
7083,diputada,20,21,-1,"De este modo gran cantidad de mujeres resultaron electas en 1951 por el partido para ocupar cargos legislativos : 23 diputadas nacionales , 6 senadoras nacionales , y si se cuentan a las legisladoras provinciales fueron electas en total 109 mujeres . ",Fem,parataxis,Plur,23,"De este modo gran cantidad de mujeres resultaron electas en 1951 por el partido para ocupar cargos legislativos : 23 diputados nacionales , 6 senadoras nacionales , y si se cuentan a las legisladoras provinciales fueron electas en total 109 mujeres . ",20,Masc
7180,individuo,1,-1,0,Los individuos más jóvenescon una longitud de menos de 3 cm ( 1 pulgada ) son de color gris marrón . ,Masc,nsubj,Plur,16,Las individuas más jóvenescon una longitud de menos de 3 cm ( 1 pulgada ) son de color gris marrón . ,1,Fem
7216,mujer,6,-1,5,"Luego , a mí ya mi mujer nos sacaron de allí y nos metieron en una ratonera en el barrio Pueyrredón , en una casa de Oropel . ",Fem,conj,Sing,4,"Luego , a mí ya mi hombre nos sacaron de allí y nos metieron en una ratonera en el barrio Pueyrredón , en una casa de Oropel . ",6,Masc
7256,antepasado,1,2,0,Sus antepasados esquimo - aleutianos cruzaron el estrecho de Bering y se asentaron también en Norteamérica . ,Masc,nsubj,Plur,6,Sus antepasadas esquima - aleutianos cruzaron el estrecho de Bering y se asentaron también en Norteamérica . ,1,Fem
7283,historiador,1,-1,0,Los historiadores de la radio aseguran que los emparejamientos de Rayburn con Lescoulie y con Finch fueron los primeros dúos masculinos de las mañanas radiofónicas . ,Masc,nsubj,Plur,6,Las historiadoras de la radio aseguran que los emparejamientos de Rayburn con Lescoulie y con Finch fueron los primeros dúos masculinos de las mañanas radiofónicas . ,1,Fem
7450,actor,25,26,24,"La película estaba basada en una atracción de parque temático y Johnny Depp , más conocido por actuar en películas de culto , era un actor principal con pocos resultados en taquilla . ",Masc,conj,Sing,10,"La película estaba basada en una atracción de parque temático y Johnny Depp , más conocido por actuar en películas de culto , era una actriz principal con pocos resultados en taquilla . ",25,Fem
7457,hijo,4,-1,-1,"El Zar no tenía hijos , y su heredero , el gran duque Constantino Pávlovich , renunció a sus derechos de sucesión en 1822 , lo que convertía a Nicolás en el nuevo Zarévich . ",Masc,obj,Plur,2,"El Zar no tenía hijas , y su heredero , el gran duque Constantino Pávlovich , renunció a sus derechos de sucesión en 1822 , lo que convertía a Nicolás en el nuevo Zarévich . ",4,Fem
7466,hermana,11,-1,10,"Con la ayuda de sus amigos Lamb logró evitar que su hermana fuese encarcelada de por vida , con la condición de que sería responsable de ella . ",Fem,nsubj,Sing,3,"Con la ayuda de sus amigos Lamb logró evitar que su hermano fuese encarcelada de por vida , con la condición de que sería responsable de ella . ",11,Masc
7488,dueña,19,-1,18,Queríamos ir un grupo de 8 personas - por lo que cabríamos en la casa grande - pero la dueña de la casa nos dijo que para hacer uso de la piscina teníamos que alquilar las dos casas . ,Fem,nsubj,Sing,6,Queríamos ir un grupo de 8 personas - por lo que cabríamos en la casa grande - pero el dueño de la casa nos dijo que para hacer uso de la piscina teníamos que alquilar las dos casas . ,19,Masc
7507,jugador,11,-1,10,El jugador de nivel que entra en este esquema es un jugador de ataque que se sabe muy superior a su rival y le hará la vida imposible más adelante . ,Masc,root,Sing,32,La jugadora de nivel que entra en este esquema es una jugadora de ataque que se sabe muy superior a su rival y le hará la vida imposible más adelante . ,11,Fem
7533,aficionado,1,-1,0,"Los aficionados podrán avanzar en todos los niveles de buceo , obteniendo hasta 6 certificaciones distintas , desde el "" Open Water Diver "" con las primeras inmersiones hasta el "" Dive Master "" , el nivel más avanzado . ",Masc,nsubj,Plur,3,"Las aficionadas podrán avanzar en todos los niveles de buceo , obteniendo hasta 6 certificaciones distintas , desde el "" Open Water Diver "" con las primeras inmersiones hasta el "" Dive Master "" , el nivel más avanzado . ",1,Fem
7543,empleado,9,-1,-1,Antes de entrar en la vida religiosa trabajó como empleado . ,Masc,obl,Sing,3,Antes de entrar en la vida religiosa trabajó como empleada . ,9,Fem
7571,actor,1,-1,0,"Los actores debieron volver a rodar , además , esas escenas en escenarios de captura de movimiento . ",Masc,nsubj,Plur,3,"Las actrices debieron volver a rodar , además , esas escenas en escenarios de captura de movimiento . ",1,Fem
7579,actor,12,-1,-1,Antes de su papel en Guardianes de la Noche ya era un actor popular y conocido en el teatro y la televisión de Rusia . ,Masc,fixed,Sing,2,Antes de su papel en Guardianes de la Noche ya era un actriz popular y conocido en el teatro y la televisión de Rusia . ,12,Fem
7625,hijo,1,-1,0,Mis hijos mientras tanto desaparecieron con los juegos de play y el minicine . ,Masc,nsubj,Plur,3,Mis hijas mientras tanto desaparecieron con los juegos de play y el minicine . ,1,Fem
7689,compañero,2,-1,1,De los compañeros puedo decir lo mismo . ,Masc,obl,Plur,4,De las compañeras puedo decir lo mismo . ,2,Fem
7697,madre,2,-1,1,"De su madre Arnoldo dice sencillamente "" fue una gran amante de la oración "" . ",Fem,obl,Sing,4,"De su padre Arnoldo dice sencillamente "" fue una gran amante de la oración "" . ",2,Masc
7715,madre,1,-1,0,"La madre se casó con William Molard , músico medio francés y medio noruego , y se instalaron en París . ",Fem,nsubj,Sing,3,"El padre se casó con William Molard , músico medio francés y medio noruego , y se instalaron en París . ",1,Masc
7731,empleado,4,7,3,"Y uno de sus empleados contables más famosos fue el presidente Julio Lozano Díaz , quien en 1938 publicaría "" La Industria Minera protegida por el Estado de Honduras "" todo esto debido a que el año anterior ( 1937 ) la empresa minera norteamericana llegara a un punto culminante de ganancias , mediante una superproducción de aproximada de 3,211296 onzas de oro registradas como plata por motivos impositivos . ",Masc,nmod,Plur,7,"Y uno de sus empleadas contables más famosas fue el presidente Julio Lozano Díaz , quien en 1938 publicaría "" La Industria Minera protegida por el Estado de Honduras "" todo esto debido a que el año anterior ( 1937 ) la empresa minera norteamericana llegara a un punto culminante de ganancias , mediante una superproducción de aproximada de 3,211296 onzas de oro registradas como plata por motivos impositivos . ",4,Fem
7755,jefe,17,-1,-1,"Después de los combates de Sette - Pani en Pouzzole sur le Mincio , pasa a ser jefe de batallón de un Regimiento de Línea . ",Masc,obl,Sing,11,"Después de los combates de Sette - Pani en Pouzzole sur le Mincio , pasa a ser jefa de batallón de un Regimiento de Línea . ",17,Fem
7773,amigo,9,-1,8,El pasado fin de semana me acerqué con unos amigos a conocer Palencia . ,Masc,obl,Plur,4,El pasado fin de semana me acerqué con unas amigas a conocer Palencia . ,9,Fem
7798,hombre,4,1,-1,"En total , 23.100 hombres . ",Masc,root,Plur,7,"En total , 23.100 mujeres . ",4,Fem
7799,actriz,4,-1,-1,Muy bien considerada como actriz . ,Fem,nmod,Sing,3,Muy bien considerada como actor . ,4,Masc
7818,hombre,10,-1,-1,"Fabio anticipó el movimiento y bloqueó el paso con 4.000 hombres , acampando cerca con el ejército principal . ",Masc,obl,Plur,4,"Fabio anticipó el movimiento y bloqueó el paso con 4.000 mujeres , acampando cerca con el ejército principal . ",10,Fem
7826,padre,13,-1,-1,"La producción concluye con una canción de Oscar Conde , No te llames padre , que alude a la responsabilidad de la paternidad . ",Masc,obj,Sing,2,"La producción concluye con una canción de Oscar Conde , No te llames madre , que alude a la responsabilidad de la paternidad . ",13,Fem
7855,actor,22,-1,-1,"Charles Duncan , que interpretaba a Spit , dejó la producción , y Leo , su suplente , se vio promocionado como actor . ",Masc,obl,Sing,3,"Charles Duncan , que interpretaba a Spit , dejó la producción , y Leo , su suplente , se vio promocionado como actriz . ",22,Fem
7857,escritor,25,28,24,"Patriarca de las letras gallegas , este orensano de pro perteneciente a la Generación Nós ( "" Nosotros "" ) , es uno de los escritores gallegos más importantes . ",Masc,nmod,Plur,7,"Patriarca de las letras gallegas , este orensano de pro perteneciente a la Generación Nós ( "" Nosotros "" ) , es uno de las escritoras gallegas más importantes . ",25,Fem
7863,padre,14,-1,13,"Desde pequeña manifesto interés y talento por la actuación , por lo que sus padres la inscribieron en la escuela infantil de teatro Vår Teater , a los ocho años de edad . ",Masc,nsubj,Plur,3,"Desde pequeña manifesto interés y talento por la actuación , por lo que sus madres la inscribieron en la escuela infantil de teatro Vår Teater , a los ocho años de edad . ",14,Fem
7929,hombre,1,-1,0,"Los hombres tenían unos ingresos medios de $ 27,000 frente a los $ 19,297 para las mujeres . ",Masc,nsubj,Plur,3,"Las mujeres tenían unos ingresos medios de $ 27,000 frente a los $ 19,297 para las mujeres . ",1,Fem
7947,funcionario,11,12,-1,"En 1963 marchó a vivir a Madrid , donde trabaja como funcionario público en la Administración Central . ",Masc,obl,Sing,4,"En 1963 marchó a vivir a Madrid , donde trabaja como funcionaria pública en la Administración Central . ",11,Fem
7951,ganador,1,-1,0,"El ganador de cada grupo ascendió a la División I para el Campeonato Mundial Sub - 20 de Hockey sobre Hielo 2010 , mientras que el último de cada grupo descendió a la División III . ",Masc,nsubj,Sing,6,"La ganadora de cada grupo ascendió a la División I para el Campeonato Mundial Sub - 20 de Hockey sobre Hielo 2010 , mientras que el último de cada grupo descendió a la División III . ",1,Fem
8035,mujer,10,-1,9,"Fueron tan crueles los ataques que en primer lugar las mujeres y niños fueron enviados a vivir lejos , junto con los hombres de la Casa de Hador . ",Fem,nsubj:pass,Plur,5,"Fueron tan crueles los ataques que en primer lugar los hombres y niños fueron enviados a vivir lejos , junto con los hombres de la Casa de Hador . ",10,Masc
8085,pareja,1,-1,0,La pareja tuvo tres hijos y un gran número de hijas . ,Fem,nsubj,Sing,3,El socio tuvo tres hijos y un gran número de hijas . ,1,Masc
8085,hijo,4,-1,-1,La pareja tuvo tres hijos y un gran número de hijas . ,Masc,obj,Plur,9,La pareja tuvo tres hijas y un gran número de hijas . ,4,Fem
8102,niño,10,-1,9,En la leyendas pipiles los mitos se enfocan en los niños o muchachos de la lluvia . ,Masc,obl,Plur,9,En la leyendas pipiles los mitos se enfocan en las niñas o muchachos de la lluvia . ,10,Fem
8108,mujer,10,-1,9,"Fueron tan crueles los ataques que en primer lugar las mujeres y niños fueron enviados a vivir lejos , junto con los hombres de la Casa de Hador . ",Fem,nsubj:pass,Plur,5,"Fueron tan crueles los ataques que en primer lugar los hombres y niños fueron enviados a vivir lejos , junto con los hombres de la Casa de Hador . ",10,Masc
8168,trabajador,13,-1,12,"Cumplió un gran servicio para los capitalistas utilizando su origen obrero contra los trabajadores , como hizo recientemente atacando el derecho de huelga de los estatales . ",Masc,obl,Plur,4,"Cumplió un gran servicio para los capitalistas utilizando su origen obrero contra las trabajadoras , como hizo recientemente atacando el derecho de huelga de los estatales . ",13,Fem
8217,pareja,11,12,10,"Por ello exclamó : « ¡ Todas las criaturas tienen la pareja apropiada , menos yo ! ",Fem,obj,Sing,4,"Por ello exclamó : « ¡ Todas las criaturas tienen el socio apropiado , menos yo ! ",11,Masc
8239,jugador,1,-1,0,"El jugador puede elegir entre el sargento Nicholai , el teniente Mikhail o el mercenario Carlos . ",Masc,nsubj,Sing,3,"La jugadora puede elegir entre el sargento Nicholai , el teniente Mikhail o el mercenario Carlos . ",1,Fem
8283,músico,0,5,-1,"Músico , compositor y productor mexicano . ",Masc,root,Sing,8,"Música , compositor y productor mexicana . ",0,Fem
8314,hombre,2,-1,1,"Mientras el hombre grita ante el cuervo , este sólo le responde « nunca más » . ",Masc,nsubj,Sing,3,"Mientras la mujer grita ante el cuervo , este sólo le responde « nunca más » . ",2,Fem
8402,jugador,18,-1,17,"En vez de jugar con un sólo pj a la vez , se juega con varios personajes los jugadores pueden controlar una party de hasta tres personajes a la vez que lo hacen similar a un gameplay de un juego de estratégia en tiempo real . ",Masc,nsubj,Plur,3,"En vez de jugar con un sólo pj a la vez , se juega con varios personajes las jugadoras pueden controlar una party de hasta tres personajes a la vez que lo hacen similar a un gameplay de un juego de estratégia en tiempo real . ",18,Fem
8425,música,32,34,31,"En 1948 , partió hacia los Estados Unidos en dónde no le resultó posible revitalizar su carrera de concertista de piano , pero continuó componiendo y se empezó a interesar por la música folclórica americana . ",Fem,obl,Sing,6,"En 1948 , partió hacia los Estados Unidos en dónde no le resultó posible revitalizar su carrera de concertista de piano , pero continuó componiendo y se empezó a interesar por el músico folclórico americana . ",32,Masc
8440,aficionado,8,-1,7,Samus ha sido generalmente bien recibido por los aficionados a los videojuegos . ,Masc,obl,Plur,7,Samus ha sido generalmente bien recibido por las aficionadas a los videojuegos . ,8,Fem
8468,esposo,17,-1,16,"Glaumvör , la esposa de Gunnarr también había tenido malos sueños y se los explicó a su esposo , pero este también hizo caso omiso a las advertencias . ",Masc,iobj,Sing,4,"Glaumvör , la esposa de Gunnarr también había tenido malos sueños y se los explicó a su esposa , pero este también hizo caso omiso a las advertencias . ",17,Fem
8471,autor,1,-1,-1,"Es autor de distintas obras de análisis político y sociológico entre las que se destaca "" Política y Partidos en Bolivia "" , donde trata sobre las ideas políticas y presenta un estudio sobre los partidos bolivianos . ",Masc,root,Sing,39,"Es autora de distintas obras de análisis político y sociológico entre las que se destaca "" Política y Partidos en Bolivia "" , donde trata sobre las ideas políticas y presenta un estudio sobre los partidos bolivianos . ",1,Fem
8496,hijo,10,-1,-1,Insistió en regresar a Inglaterra antes de comenzar a tener hijos . ,Masc,obj,Plur,2,Insistió en regresar a Inglaterra antes de comenzar a tener hijas . ,10,Fem
8669,ganador,5,-1,4,Los jurados escogen a los ganadores de entre una previa selección de nominados ( no superior a siete ) . ,Masc,obj,Plur,4,Los jurados escogen a las ganadoras de entre una previa selección de nominados ( no superior a siete ) . ,5,Fem
8679,elector,8,-1,-1,El diario Crítica calculaba que Tamborini obtendría 332 electores contra sólo 44 de Perón . ,Masc,obj,Plur,3,El diario Crítica calculaba que Tamborini obtendría 332 electoras contra sólo 44 de Perón . ,8,Fem
8763,mujer,4,-1,3,"Buenas tardes , mi mujer fue por un masaje terapeutico por dolor en la espalda , no salio nada contenta con el masaje recibido . ",Fem,nsubj,Sing,3,"Buenas tardes , mi hombre fue por un masaje terapeutico por dolor en la espalda , no salio nada contenta con el masaje recibido . ",4,Masc
8781,amigo,11,-1,-1,"Su atención es cálida y excelente , te hacen sentir entre amigos . ",Masc,obl,Plur,3,"Su atención es cálida y excelente , te hacen sentir entre amigas . ",11,Fem
8808,madre,26,-1,-1,La Catedral de Cristo de la Luz o también como la Catedral de Oakland ( en inglés : Cathedral of Christ the Light ) es la madre iglesia de la Diócesis de Oakland . ,Fem,root,Sing,35,La Catedral de Cristo de la Luz o también como la Catedral de Oakland ( en inglés : Cathedral of Christ the Light ) es la padre iglesia de la Diócesis de Oakland . ,26,Masc
8841,príncipe,2,-1,1,Pronto el príncipe entra en contacto con las altas capas de la sociedad petersburguesa y se enamora de dos damas muy diferentes que marcarán su estadía allí : Nastasia Filíppovna y Aglaya Ivanovna Yepanchina . ,Masc,nsubj,Sing,3,Pronto la princesa entra en contacto con las altas capas de la sociedad petersburguesa y se enamora de dos damas muy diferentes que marcarán su estadía allí : Nastasia Filíppovna y Aglaya Ivanovna Yepanchina . ,2,Fem
8856,amigo,2,-1,0,"Los dos amigos celebran un pacto de alianza , pronunciando su juramento de fidelidad , a la usanza de los antiguos germanos . ",Masc,nsubj,Plur,4,"Las dos amigas celebran un pacto de alianza , pronunciando su juramento de fidelidad , a la usanza de los antiguos germanos . ",2,Fem
8918,doctor,15,-1,14,"Afirmando que la batería de su automóvil esta baja y él necesita ver a un doctor urgentemente ya que su esposa esta enferma , el hombre es llevado por Prescott . ",Masc,obj,Sing,4,"Afirmando que la batería de su automóvil esta baja y él necesita ver a una doctora urgentemente ya que su esposa esta enferma , el hombre es llevado por Prescott . ",15,Fem
8918,esposa,20,-1,19,"Afirmando que la batería de su automóvil esta baja y él necesita ver a un doctor urgentemente ya que su esposa esta enferma , el hombre es llevado por Prescott . ",Fem,nsubj,Sing,3,"Afirmando que la batería de su automóvil esta baja y él necesita ver a un doctor urgentemente ya que su esposo esta enferma , el hombre es llevado por Prescott . ",20,Masc
8918,hombre,25,-1,24,"Afirmando que la batería de su automóvil esta baja y él necesita ver a un doctor urgentemente ya que su esposa esta enferma , el hombre es llevado por Prescott . ",Masc,nsubj:pass,Sing,3,"Afirmando que la batería de su automóvil esta baja y él necesita ver a un doctor urgentemente ya que su esposa esta enferma , la mujer es llevado por Prescott . ",25,Fem
8928,madre,2,-1,1,Incluso varias madres con sus hijos se acercan a la fiesta y alguna de ellas ofrece vino a los pequeños . ,Fem,obj,Plur,6,Incluso varios padres con sus hijos se acercan a la fiesta y alguna de ellas ofrece vino a los pequeños . ,2,Masc
8959,hombre,6,-1,5,"A pesar de todo , el hombre divulga la ubicación de Bill . ",Masc,nsubj,Sing,3,"A pesar de todo , la mujer divulga la ubicación de Bill . ",6,Fem
8978,chica,1,-1,0,"La chica , es muy guapa y amable , la ropa es a la moda y salí muy satisfecho . ",Fem,nsubj,Sing,3,"El chico , es muy guapo y amable , la ropa es a la moda y salí muy satisfecho . ",1,Masc
9006,hombre,37,-1,36,"Mientras Boves recibía un gran baile de victoria , su segundo comandante repasó las casas y hospitales de la ciudad para rematar a los patriotas heridos , y luego procedió a asesinar a París y a sus hombres a cuchillo . ",Masc,conj,Plur,5,"Mientras Boves recibía un gran baile de victoria , su segundo comandante repasó las casas y hospitales de la ciudad para rematar a los patriotas heridos , y luego procedió a asesinar a París y a sus mujeres a cuchillo . ",37,Fem
9037,alemán,20,-1,-1,Tuvimos que sacar el coche fuera de ese horario y nos encontramos que el personal de recepción sólo hablaba en alemán . ,Masc,obl,Sing,3,Tuvimos que sacar el coche fuera de ese horario y nos encontramos que el personal de recepción sólo hablaba en alemana . ,20,Fem
9081,productora,5,-1,4,A finales de octubre la productora buscó promocionar la película en el país europeo con un circo chino inspirado en los personajes y el cual estuvo ubicado en el cine Coliseum de Madrid . ,Fem,nsubj,Sing,3,A finales de octubre el productor buscó promocionar la película en el país europeo con un circo chino inspirado en los personajes y el cual estuvo ubicado en el cine Coliseum de Madrid . ,5,Masc
9108,amigo,18,-1,17,"Aunque ella se viste como una gótica , ella es muy sociable y se preocupa mucho por sus amigos y siempre estará para ellos en una mala situación . ",Masc,obl,Plur,4,"Aunque ella se viste como una gótica , ella es muy sociable y se preocupa mucho por sus amigas y siempre estará para ellos en una mala situación . ",18,Fem
9148,mujer,1,-1,0,"Algunas mujeres también prefieren este método sobre la contracepción hormonal para revertir efectos adversos , tales como depresión , cambios de humor , sequedad vaginal , disminución de la libido y cefaleas , entre otros . ",Fem,nsubj,Plur,3,"Algunos hombres también prefieren este método sobre la contracepción hormonal para revertir efectos adversos , tales como depresión , cambios de humor , sequedad vaginal , disminución de la libido y cefaleas , entre otros . ",1,Masc
9162,usuario,1,-1,0,"El usuario de contenidos digitales de Amazon obtiene almacenamiento gratuito en la Amazon Cloud , e incluye una aplicación de correo electrónico que permite fusionar webmails como Gmail , Yahoo! , Hotmail , AOL Mail , etc. en una sola bandeja de entrada . ",Masc,nsubj,Sing,8,"La usuaria de contenidos digitales de Amazon obtiene almacenamiento gratuito en la Amazon Cloud , e incluye una aplicación de correo electrónico que permite fusionar webmails como Gmail , Yahoo! , Hotmail , AOL Mail , etc. en una sola bandeja de entrada . ",1,Fem
9175,director,7,8,6,"Desde aquello se ha convertido en el director artístico de la banda , contribuyendo con fotografía , diseño web , portadas , videoclips , diseños visuales para giras y realización de dos películas sobre las giras de la banda . ",Masc,obl,Sing,8,"Desde aquello se ha convertido en la directora artística de la banda , contribuyendo con fotografía , diseño web , portadas , videoclips , diseños visuales para giras y realización de dos películas sobre las giras de la banda . ",7,Fem
9250,chico,6,-1,5,"A la mañana siguiente , los chicos descubren que el papá de Nora también está metido en el plan , y Sam lanza una manzana para distraer a la familia dershlit creyendo que Gibby sigue en la casa . ",Masc,nsubj,Plur,3,"A la mañana siguiente , las chicas descubren que el papá de Nora también está metido en el plan , y Sam lanza una manzana para distraer a la familia dershlit creyendo que Gibby sigue en la casa . ",6,Fem
9278,individuo,6,-1,-1,Solamente deseamos que no nos caigan individuos de esta calaña . ,Masc,nsubj,Plur,5,Solamente deseamos que no nos caigan individuas de esta calaña . ,6,Fem
9309,muchacho,4,-1,3,Fue entonces cuando un muchacho de barba entró con un papel . ,Masc,nsubj,Sing,5,Fue entonces cuando una muchacha de barba entró con un papel . ,4,Fem
9316,mujer,10,-1,9,"Cuando su familia está en un restaurante , y su mujer habla con Dios ( este como un mesero ) , que le dice que la historia de Noé tal vez no representaba la cólera de Dios , si no una manera de creer el uno en el otro , que por eso los animales aparecían en parejas , y le dice que seria una buena oportunidad para estar juntos , por lo que deciden volver con él . ",Fem,nsubj,Sing,3,"Cuando su familia está en un restaurante , y su hombre habla con Dios ( este como un mesero ) , que le dice que la historia de Noé tal vez no representaba la cólera de Dios , si no una manera de creer el uno en el otro , que por eso los animales aparecían en parejas , y le dice que seria una buena oportunidad para estar juntos , por lo que deciden volver con él . ",10,Masc
9403,hombre,1,-1,0,"Los hombres tenían unos ingresos medios de $ 49,290 frente a los $ 35,510 para las mujeres . ",Masc,nsubj,Plur,3,"Las mujeres tenían unos ingresos medios de $ 49,290 frente a los $ 35,510 para las mujeres . ",1,Fem
9409,diseñador,24,29,23,"Louis Schmeisser ( * Zöllnitz , Turingia , 5 de febrero de 1848 -- 23 de marzo de 1917 ) fue uno de los diseñadores técnicos de armas más conocidos de Europa . ",Masc,nmod,Plur,11,"Louis Schmeisser ( * Zöllnitz , Turingia , 5 de febrero de 1848 -- 23 de marzo de 1917 ) fue uno de las diseñadoras técnicas de armas más conocidas de Europa . ",24,Fem
9474,hijo,15,-1,14,"Entonces ordenó a Domicio Alejandro , el gobernador de la provincia , enviar a su hijo a Roma para asegurar así su lealtad . ",Masc,obj,Sing,4,"Entonces ordenó a Domicio Alejandro , el gobernador de la provincia , enviar a su hija a Roma para asegurar así su lealtad . ",15,Fem
9495,hija,3,-1,2,"Llevamos a nuestra hija desde hace poco , estamos bastante contentos . ",Fem,obj,Sing,4,"Llevamos a nuestro hijo desde hace poco , estamos bastante contentos . ",3,Masc
9500,ciudadano,10,-1,9,Los que pagan los sueldos de los ministros son los ciudadanos . ,Masc,nsubj,Plur,3,Las que pagan los sueldos de los ministros son las ciudadanas . ,10,Fem
9509,investigador,4,-1,3,"Sin embargo , muchos investigadores consideran que este censo no representa el verdadero tamaño de la población de tinkers . ",Masc,nsubj,Plur,3,"Sin embargo , muchas investigadoras consideran que este censo no representa el verdadero tamaño de la población de tinkers . ",4,Fem
9556,hijo,9,-1,-1,Está casado desde el año 1962 y tiene tres hijos y cinco nietos . ,Masc,obj,Plur,6,Está casado desde el año 1962 y tiene tres hijas y cinco nietos . ,9,Fem
